<?xml version="1.0" encoding="UTF-8"?>
<!--

    Copyright (C) 2018 toop.eu

    Licensed under the Apache License, Version 2.0 (the "License");
    you may not use this file except in compliance with the License.
    You may obtain a copy of the License at

            http://www.apache.org/licenses/LICENSE-2.0

    Unless required by applicable law or agreed to in writing, software
    distributed under the License is distributed on an "AS IS" BASIS,
    WITHOUT WARRANTIES OR CONDITIONS OF ANY KIND, either express or implied.
    See the License for the specific language governing permissions and
    limitations under the License.

-->
<DataRequest xmlns:xsi="http://www.w3.org/2001/XMLSchema-instance" xsi:noNamespaceSchemaLocation="../../main/resources/datarequest.xsd">
  <DocumentIdentifier>DocumentIdentifier</DocumentIdentifier>
  <DocumentIssueDate>DocumentIssueDate</DocumentIssueDate>
  <DocumentIssueTime>DocumentIssueTime</DocumentIssueTime>
  <DocumentVerseionIdentifier>DocumentVerseionIdentifier</DocumentVerseionIdentifier>
  <CopyIndicator>CopyIndicator</CopyIndicator>
  <BusinessProcessTypeIdentifier>BusinessProcessTypeIdentifier</BusinessProcessTypeIdentifier>
  <SpecificationIdentification>SpecificationIdentification</SpecificationIdentification>
  <DataConsumer>
    <DCName>DCName</DCName>
    <DCIdentifier>DCIdentifier</DCIdentifier>
    <DCElectronicAddressIdentifier>DCElectronicAddressIdentifier</DCElectronicAddressIdentifier>
    <DCCountry>DCCountry</DCCountry>
    <DCName>DCName</DCName>
    <DataSubject>
      <OrganisationIdentifer>OrganisationIdentifer</OrganisationIdentifer>
      <OrganisationName>OrganisationName</OrganisationName>
      <CountryOfRegistration>CountryOfRegistration</CountryOfRegistration>
    </DataSubject>
    <DataOwner>
      <NaturalPersonFirstName>NaturalPersonFirstName</NaturalPersonFirstName>
      <NaturalPersonFamilyName>NaturalPersonFamilyName</NaturalPersonFamilyName>
      <NaturalPersonBirthPlace>NaturalPersonBirthPlace</NaturalPersonBirthPlace>
      <NaturalPersonBirthData>NaturalPersonBirthData</NaturalPersonBirthData>
      <NaturalPersonIdentifier>NaturalPersonIdentifier</NaturalPersonIdentifier>
      <NaturalPersonNationality>NaturalPersonNationality</NaturalPersonNationality>
    </DataOwner>
    <DataConsumerAuthorization>
      <ConsentToken>ConsentToken</ConsentToken>
    </DataConsumerAuthorization>
  </DataConsumer>
  <DataConsumerRequest>
    <DocumentRequestIndicator>DocumentRequestIndicator</DocumentRequestIndicator>
    <DocumentRequestTypeCode>DocumentRequestTypeCode</DocumentRequestTypeCode>
    <DataConsumerRequestIdentifer>DataConsumerRequestIdentifer</DataConsumerRequestIdentifer>
    <DataElementRequest>
      <DataRequestIdentifier>DataRequestIdentifier</DataRequestIdentifier>
      <DataConsumerConcept>DataConsumerConcept</DataConsumerConcept>
      <DataConsumerConceptIdentifier>DataConsumerConceptIdentifier</DataConsumerConceptIdentifier>
      <DataConsumerConceptURI>DataConsumerConceptURI</DataConsumerConceptURI>
      <DataConsumerNamespace>DataConsumerNamespace</DataConsumerNamespace>
      <DataConsumerDataFormat>DataConsumerDataFormat</DataConsumerDataFormat>
      <ToopConcept>ToopConcept</ToopConcept>
      <ToopDataType>ToopDataType</ToopDataType>
      <ToopConceptSuperclass>ToopConceptSuperclass</ToopConceptSuperclass>
      <ToopConceptIdentifier>ToopConceptIdentifier</ToopConceptIdentifier>
      <ToopConceptURI>ToopConceptURI</ToopConceptURI>
      <ToopConceptDomain>ToopConceptDomain</ToopConceptDomain>
      <ToopNamespace>ToopNamespace</ToopNamespace>
    </DataElementRequest>
  </DataConsumerRequest>
</DataRequest>
